{
 "$schema": "https://json-schema.org/draft/2020-12/schema",
 "$id": "tools/kisa/schema.json",
 "title": "KISA 보안공지 주간 리포트 호별 데이터",
 "description": "content/kisa-cert/<week_start>.json 의 형식. tools/kisa/render.py 가 이 데이터를 templates/kisa-cert/page.html 에 넣어 HTML을 만든다. 본문 글자(rich)는 **굵게**, `코드`, [미확인], 줄바꿈(\\n)만 해석하고 나머지는 모두 그대로 보인다. HTML 태그를 쓰지 않는다.",
 "type": "object",
 "additionalProperties": false,
 "required": ["schema_version", "id", "week_start", "published_date", "generated_at", "provenance",
              "preheader", "overview", "priority", "items", "audience", "notes", "footer_sources"],
 "properties": {
  "schema_version": {"const": 1},
  "id": {"type": "string", "pattern": "^kisa-weekly-\\d{4}-\\d{2}-\\d{2}$", "description": "kisa-weekly-<week_start>. 코드가 정한다."},
  "week_start": {"$ref": "#/$defs/date", "description": "대상 주간 시작일(월요일, KST). 파일 이름에 쓴다. 코드가 정한다."},
  "published_date": {"$ref": "#/$defs/date", "description": "이 리포트의 발행일. 화면 발행일·portal-date·목록 정렬에 쓴다. 처음 생성할 때 코드가 정하고 다시 계산하지 않는다(이전된 호는 게시본 머리말에서 추출)."},
  "generated_at": {"type": "string", "pattern": "^\\d{4}-\\d{2}-\\d{2}T\\d{2}:\\d{2}:\\d{2}\\+09:00$", "description": "자동화(또는 이전 작업) 실행 시각, KST. HTML에는 넣지 않는다."},
  "provenance": {
   "type": "object",
   "additionalProperties": false,
   "required": ["type"],
   "description": "이 데이터가 어떻게 만들어졌는지. migrated = 기존 게시본 HTML을 옮겨 적은 호. 검사 면제 여부는 이 칸만 믿지 않고 tools/kisa 의 고정 목록으로도 확인한다.",
   "properties": {
    "type": {"enum": ["migrated", "generated"]},
    "source_html": {"type": "string", "description": "migrated 일 때 원본 HTML 경로"},
    "source_commit": {"type": "string", "description": "migrated 일 때 원본을 읽은 커밋"}
   }
  },
  "preheader": {"$ref": "#/$defs/rich", "description": "숨김 미리보기 한 줄 요약"},
  "overview": {"type": "array", "minItems": 1, "items": {"$ref": "#/$defs/rich"}, "description": "1. 한눈에 보기 문단들"},
  "overview_note": {"$ref": "#/$defs/rich", "description": "1. 한눈에 보기 끝의 회색 ※ 문단(선택)"},
  "priority": {
   "type": "array", "minItems": 1, "description": "2. 우선순위 표의 행",
   "items": {
    "type": "object", "additionalProperties": false,
    "required": ["target", "vuln", "severity", "cvss", "exploitation", "deadline"],
    "properties": {
     "target": {"$ref": "#/$defs/rich", "description": "대상(굵게)"},
     "target_note": {"$ref": "#/$defs/rich", "description": "대상 아래 회색 줄(KISA #·KEV 등재일 등)"},
     "vuln": {"$ref": "#/$defs/rich", "description": "핵심 취약점 첫 줄"},
     "vuln_details": {"type": "array", "items": {"$ref": "#/$defs/rich"}, "description": "핵심 취약점 아래 회색 줄들"},
     "severity": {"$ref": "#/$defs/severity"},
     "cvss": {"$ref": "#/$defs/rich", "description": "위험도 칸의 회색 줄(CVSS 등)"},
     "exploitation": {"$ref": "#/$defs/rich", "description": "악용 상태(굵게)"},
     "exploitation_notes": {"type": "array", "items": {"$ref": "#/$defs/rich"}},
     "deadline": {"$ref": "#/$defs/rich", "description": "권고 기한(굵게)"},
     "deadline_note": {"$ref": "#/$defs/rich"}
    }
   }
  },
  "items": {
   "type": "array", "minItems": 1, "description": "3. 공지별 조치 방법과 조치 확인 방법. 번호(3-1, 3-2 …)는 순서대로 코드가 붙인다.",
   "items": {
    "type": "object", "additionalProperties": false,
    "required": ["title", "severity", "situation", "remediation", "verification", "compromise_check", "sources"],
    "description": "머리 줄(제목 아래 줄)은 두 방식 중 정확히 하나로 쓴다. 섞으면 실패.",
    "oneOf": [
     {"type": "object", "required": ["meta", "meta_refs"], "description": "글자 머리 줄 — 이전된 호 전용"},
     {"type": "object", "required": ["vulnerabilities", "notices"], "description": "구조화 칸 — 새 호. 머리 줄은 render.py가 만든다"}
    ],
    "properties": {
     "title": {"$ref": "#/$defs/rich", "description": "항목 제목(줄바꿈 허용)"},
     "severity": {"$ref": "#/$defs/severity"},
     "meta": {"$ref": "#/$defs/rich", "description": "제목 아래 줄의 앞부분(CVSS · 악용 상태). 이전된 호 전용"},
     "meta_refs": {"$ref": "#/$defs/rich", "description": "제목 아래 줄의 뒷부분(KISA 공지·게시일·KEV 등재일). 이전된 호 전용"},
     "vulnerabilities": {"type": "array", "minItems": 1, "items": {"$ref": "#/$defs/vulnerability"},
                         "description": "이 항목에서 기록한 취약점. CVE가 없는 건(cve.state=not_assigned)도 하나로 담는다"},
     "cve_total": {"type": "integer", "minimum": 1, "description": "공지 전체 CVE 수(\"외 7건\"). 기록한 수보다 작을 수 없음. 없으면 기록한 수"},
     "notices": {"$ref": "#/$defs/notices"},
     "vendor_rating": {
      "type": "object", "additionalProperties": false, "required": ["label", "src"],
      "description": "벤더 자체 등급. CVSS를 대신하지 않고 나란히 표시한다",
      "properties": {
       "label": {"enum": ["Critical", "Important", "High", "Moderate", "Medium", "Low", "Priority 1", "Priority 2", "Priority 3"]},
       "count": {"type": "integer", "minimum": 1, "description": "그 등급의 건수(\"Important 4건\")"},
       "src": {"$ref": "#/$defs/src_ref"}
      }
     },
     "addition": {"const": "긴급 추가", "description": "대상 주간이 끝난 뒤 게시된 KISA 공지를 함께 싣는 경우"},
     "situation": {"$ref": "#/$defs/lines", "description": "상황"},
     "remediation": {"$ref": "#/$defs/lines", "description": "조치"},
     "verification": {"$ref": "#/$defs/lines", "description": "조치 적용 확인"},
     "compromise_check": {"$ref": "#/$defs/lines", "description": "침해 흔적 확인"},
     "sources": {
      "type": "array", "minItems": 1, "description": "출처. 화면에는 label 을 ' · '로 이어 보여 준다.",
      "items": {
       "type": "object", "additionalProperties": false, "required": ["label", "url"],
       "properties": {
        "label": {"type": "string", "minLength": 1},
        "url": {"type": "string", "pattern": "^(https://\\S+)?$", "description": "새로 만드는 호는 필수. 이전된 호는 원본에 URL이 없으면 빈 칸."},
        "id": {"$ref": "#/$defs/src_ref", "description": "구조화 칸의 src가 가리키는 이름. 새 호는 필수, 항목 안에서 중복 금지"},
        "kind": {"enum": ["kisa", "kev", "vendor", "nvd", "cve", "research", "news", "other"],
                 "description": "출처 종류. 새 호는 필수. 사실 칸마다 근거로 쓸 수 있는 종류가 정해져 있다(research·news·other는 근거 불가)"},
        "viewed": {"type": "boolean", "description": "직접 열람했는지. false(미열람)인 출처는 사실 칸의 근거로 쓸 수 없다. 새 호는 필수"}
       }
      }
     }
    }
   }
  },
  "tracking": {
   "type": "array", "description": "3-마지막. 지난 호 수록분 — 조치 현황 추적(없으면 구획 생략)",
   "items": {
    "type": "object", "additionalProperties": false, "required": ["target", "update"],
    "properties": {
     "target": {"$ref": "#/$defs/rich"},
     "target_note": {"$ref": "#/$defs/rich"},
     "update": {"$ref": "#/$defs/rich", "description": "이번 주 확인된 신규 사실"}
    }
   }
  },
  "audience": {
   "type": "array", "minItems": 1, "description": "4. 대상별 이번 주 권고 조치",
   "items": {
    "type": "object", "additionalProperties": false, "required": ["audience", "actions", "deadline"],
    "properties": {
     "audience": {"$ref": "#/$defs/rich"},
     "actions": {"$ref": "#/$defs/rich"},
     "deadline": {"$ref": "#/$defs/rich"}
    }
   }
  },
  "notes": {
   "type": "array", "minItems": 1, "description": "5. 집계 기준과 참고 사항의 문단. 글자 또는 {\"box\": 글자}(회색 상자)",
   "items": {"oneOf": [
    {"$ref": "#/$defs/rich"},
    {"type": "object", "additionalProperties": false, "required": ["box"], "properties": {"box": {"$ref": "#/$defs/rich"}}}
   ]}
  },
  "unverified_table": {
   "type": "array", "description": "남아 있는 [미확인] 항목 표(없으면 생략)",
   "items": {
    "type": "object", "additionalProperties": false, "required": ["target", "content", "how"],
    "properties": {
     "target": {"$ref": "#/$defs/rich"},
     "target_note": {"$ref": "#/$defs/rich", "description": "대상 옆 회색 괄호(예: (2주 이월))"},
     "content": {"$ref": "#/$defs/rich"},
     "how": {"$ref": "#/$defs/rich", "description": "확인 경로"}
    }
   }
  },
  "unverified_footnote": {"$ref": "#/$defs/rich", "description": "[미확인] 표 아래 회색 ※ 문단(선택)"},
  "footer_sources": {"$ref": "#/$defs/rich", "description": "바닥글 '이번 호 출처 —' 뒤의 글"},
  "checks": {
   "type": "object", "additionalProperties": false, "required": ["kev", "kisa"],
   "description": "호 단위 확인 기록. 구조화 항목이 있는 호(새 호)는 필수. 'KEV 미등재'·'보호나라 대상 기간 공지 없음'의 근거가 된다",
   "properties": {
    "kev": {
     "type": "object", "additionalProperties": false, "required": ["catalog_version", "url", "checked_at", "complete"],
     "properties": {
      "catalog_version": {"type": "string", "pattern": "^\\d{4}\\.\\d{2}\\.\\d{2}$", "description": "조회한 KEV 판(catalogVersion). 판 날짜가 대상 기간 끝보다 이른 것은 실패가 아님"},
      "count": {"type": "integer", "minimum": 1, "description": "그 판의 전체 건수"},
      "url": {"$ref": "#/$defs/https_url", "description": "조회한 KEV 주소(www.cisa.gov, github.com/cisagov/kev-data 또는 raw.githubusercontent.com/cisagov/kev-data)"},
      "checked_at": {"$ref": "#/$defs/kst_datetime"},
      "complete": {"type": "boolean", "description": "그 판본의 전체 KEV 목록을 확보했고, 구조화 데이터에 기록된 모든 CVE를 그 목록에서 조회했는지. 기록하지 않은 CVE(cve_total 초과분)까지 조회했다는 뜻은 아님. true일 때만 kev.state=not_listed 허용"}
     }
    },
    "kisa": {
     "type": "object", "additionalProperties": false,
     "required": ["period_start", "period_end", "last_no", "url", "checked_at", "complete"],
     "properties": {
      "period_start": {"$ref": "#/$defs/date", "description": "확인한 보호나라 게시 기간 시작"},
      "period_end": {"$ref": "#/$defs/date", "description": "확인한 보호나라 게시 기간 끝"},
      "last_no": {"type": "integer", "minimum": 1, "description": "확인한 마지막 공지 번호. 이 호의 모든 KISA 번호 이상"},
      "url": {"$ref": "#/$defs/https_url", "description": "확인한 보호나라 목록 주소(www.boho.or.kr)"},
      "checked_at": {"$ref": "#/$defs/kst_datetime"},
      "complete": {"type": "boolean", "description": "그 기간의 게시물을 빠짐없이 봤는지. true이고 기간이 대상 주간을 덮을 때만 notices.kisa.state=none_in_period 허용"}
     }
    }
   }
  },
  "boilerplate": {
   "type": "object", "additionalProperties": false,
   "description": "고정 안내문을 바꿔 쓰기. 이전된 호(면제 목록)에만 허용 — 과거 호의 원래 문구 보존용. 새 호는 쓰지 않고 표준 문구를 쓴다.",
   "properties": {
    "priority_footnote": {"$ref": "#/$defs/rich", "description": "2. 우선순위 표 아래 ※ 안내문"},
    "footer_notice": {"$ref": "#/$defs/rich", "description": "바닥글 맨 아래 안내문"}
   }
  }
 },
 "$defs": {
  "date": {"type": "string", "pattern": "^\\d{4}-\\d{2}-\\d{2}$"},
  "kst_datetime": {"type": "string", "pattern": "^\\d{4}-\\d{2}-\\d{2}T\\d{2}:\\d{2}:\\d{2}\\+09:00$"},
  "https_url": {"type": "string", "pattern": "^https://\\S+$"},
  "src_ref": {"type": "string", "pattern": "^[a-z0-9][a-z0-9-]*$", "description": "같은 항목 sources의 id"},
  "vulnerability": {
   "type": "object", "additionalProperties": false, "required": ["cve", "cvss", "exploitation", "kev"],
   "properties": {
    "cve": {"oneOf": [
     {"type": "object", "additionalProperties": false, "required": ["state", "id"],
      "properties": {"state": {"const": "value"}, "id": {"type": "string", "pattern": "^CVE-\\d{4}-\\d{4,}$"}}},
     {"type": "object", "additionalProperties": false, "required": ["state"],
      "properties": {"state": {"enum": ["unknown", "not_assigned"]}}}
    ]},
    "cvss": {"oneOf": [
     {"type": "object", "additionalProperties": false, "required": ["state", "score", "version", "basis", "src"],
      "properties": {"state": {"const": "value"}, "score": {"type": "number", "minimum": 0, "maximum": 10},
                     "version": {"enum": ["3.0", "3.1", "4.0"]}, "basis": {"enum": ["vendor", "nvd", "cisa-adp"]},
                     "src": {"$ref": "#/$defs/src_ref"}}},
     {"type": "object", "additionalProperties": false, "required": ["state"],
      "properties": {"state": {"const": "unknown"}}}
    ]},
    "exploitation": {"oneOf": [
     {"type": "object", "additionalProperties": false, "required": ["state", "src"],
      "properties": {"state": {"const": "confirmed"}, "src": {"$ref": "#/$defs/src_ref"}}},
     {"type": "object", "additionalProperties": false, "required": ["state", "src", "as_of"],
      "properties": {"state": {"const": "no_report"}, "src": {"$ref": "#/$defs/src_ref"}, "as_of": {"$ref": "#/$defs/date"}}},
     {"type": "object", "additionalProperties": false, "required": ["state"],
      "properties": {"state": {"const": "unknown"}}}
    ]},
    "kev": {"oneOf": [
     {"type": "object", "additionalProperties": false, "required": ["state", "added", "due", "src"],
      "properties": {"state": {"const": "listed"}, "added": {"$ref": "#/$defs/date"}, "due": {"$ref": "#/$defs/date"},
                     "src": {"$ref": "#/$defs/src_ref"}}},
     {"type": "object", "additionalProperties": false, "required": ["state"],
      "properties": {"state": {"enum": ["not_listed", "not_applicable", "unknown"]}}}
    ]}
   }
  },
  "notices": {
   "type": "object", "additionalProperties": false, "required": ["kisa", "vendor"],
   "properties": {
    "kisa": {"oneOf": [
     {"type": "object", "additionalProperties": false, "required": ["state", "no", "posted", "src"],
      "properties": {"state": {"const": "value"}, "no": {"type": "integer", "minimum": 1},
                     "posted": {"$ref": "#/$defs/date"}, "src": {"$ref": "#/$defs/src_ref"}}},
     {"type": "object", "additionalProperties": false, "required": ["state"],
      "properties": {"state": {"const": "none_in_period", "description": "확인한 대상 기간의 보호나라 게시판에 일치하는 공지가 없었다. 화면: '보호나라 대상 기간 공지 없음'"}}}
    ]},
    "vendor": {"oneOf": [
     {"type": "object", "additionalProperties": false, "required": ["state", "advisories"],
      "properties": {"state": {"const": "value"}, "advisories": {
       "type": "array", "minItems": 1, "items": {
        "type": "object", "additionalProperties": false, "required": ["id", "src"],
        "properties": {"id": {"type": "string", "pattern": "^[^\\n]{1,80}$", "description": "공지 식별자 또는 짧은 이름"},
                       "date": {"$ref": "#/$defs/date", "description": "공지일. 없으면 머리 줄에 벤더 공지를 표시하지 않음"},
                       "src": {"$ref": "#/$defs/src_ref"}}}}}},
     {"type": "object", "additionalProperties": false, "required": ["state"],
      "properties": {"state": {"enum": ["unknown", "not_applicable"]}}}
    ]}
   }
  },
  "severity": {"enum": ["긴급", "높음", "보통", "낮음"]},
  "rich": {"type": "string", "minLength": 1, "description": "본문 글자. **굵게**, `코드`, [미확인], 줄바꿈만 해석."},
  "lines": {
   "type": "array", "minItems": 1, "description": "칸 안의 줄 목록(<br>로 이어짐). 각 줄은 글자 또는 {\"note\": 글자}(작은 회색 ※ 주석).",
   "items": {"oneOf": [
    {"$ref": "#/$defs/rich"},
    {"type": "object", "additionalProperties": false, "required": ["note"], "properties": {"note": {"$ref": "#/$defs/rich"}}}
   ]}
  }
 }
}
